{"boundaries":{"keychainEntitlementProven":false,"physicalPhoneTouched":false,"runtimePairingProven":false,"signedArtifactBuilt":false,"signingIdentityAccessed":false,"tcpPayloadEncrypted":false},"commands":["swift test --package-path macHelper","./gradlew --no-daemon --rerun-tasks :app:testOssReleaseUnitTest --tests io.codecks.data.reactive.helper.ReactiveHelperPairingImporterTest --tests io.codecks.data.reactive.helper.ReactiveHelperPairingV2ClientTest --tests io.codecks.data.reactive.helper.ReactiveHelperIdentityCodecTest :shared:jvmTest --tests io.codecks.shared.protocol.PairingV2ProtocolTest"],"executions":[{"errors":0,"failures":0,"id":"swift.mac_helper","path":"tasks/test-evidence/pairing-phase-ab-swift.log","sha256":"a2c677debb5c3785c683b12f65cecff56024ef5517d9e19da6f80febff439a8d","skipped":0,"tests":53},{"errors":0,"failures":0,"id":"android.importer","path":"tasks/test-evidence/pairing-phase-ab-android-importer.xml","sha256":"842c4ec29b6ecd761b1eb889814ff86fb502f5bfd5045233f7e9917f99c7c93e","skipped":0,"tests":4},{"errors":0,"failures":0,"id":"android.client","path":"tasks/test-evidence/pairing-phase-ab-android-client.xml","sha256":"bb3199cecf1d1ee1c0314e7ce5c296dce18833cf5c4329b89cc6e053fb27734f","skipped":0,"tests":2},{"errors":0,"failures":0,"id":"android.identity","path":"tasks/test-evidence/pairing-phase-ab-android-identity.xml","sha256":"9e13058c9f01ecda70d90524121c5303f2922a6466b56622c3bd119b87275fe1","skipped":0,"tests":4},{"errors":0,"failures":0,"id":"shared.protocol","path":"tasks/test-evidence/pairing-phase-ab-shared.xml","sha256":"baa2f8b23954db3db9855fe9402f1450c41a86784191e4fc2ad7e2b1ef81e8ce","skipped":0,"tests":2}],"lanes":[{"evidence":"EXACT_PHASE_B_BLOB_AND_CPU_UNIT","id":"source.native_mac_helper_app","status":"PASS"},{"evidence":"EXACT_PHASE_B_BLOB_AND_CPU_UNIT","id":"source.one_use_qr_offer","status":"PASS"},{"evidence":"EXACT_PHASE_B_BLOB_AND_CPU_UNIT","id":"source.per_device_pairing_auth","status":"PASS"},{"evidence":"EXACT_PHASE_B_BLOB_AND_CPU_UNIT","id":"source.matching_code_confirmation","status":"PASS"},{"evidence":"EXACT_PHASE_B_BLOB_AND_CPU_UNIT","id":"source.android_deep_link_import","status":"PASS"},{"evidence":"EXACT_PHASE_B_BLOB_AND_CPU_UNIT","id":"source.legacy_export_requires_unsafe_flag","status":"PASS"},{"evidence":"EXACT_PHASE_B_BLOB_AND_CPU_UNIT","id":"source.keychain_fail_closed_without_entitlement","status":"PASS"},{"evidence":"EXACT_PHASE_B_BLOB_AND_CPU_UNIT","id":"source.transport_discloses_no_encryption","status":"PASS"},{"evidence":"EXTERNAL_OR_ARTIFACT","id":"artifact.unsigned_local_app_build","status":"NOT_RUN"},{"evidence":"EXTERNAL_OR_ARTIFACT","id":"artifact.signed_helper_app","status":"NOT_RUN"},{"evidence":"EXTERNAL_OR_ARTIFACT","id":"runtime.keychain_entitlement_probe","status":"NOT_RUN"},{"evidence":"EXTERNAL_OR_ARTIFACT","id":"runtime.mac_to_android_pairing","status":"NOT_RUN"},{"evidence":"EXTERNAL_OR_ARTIFACT","id":"physical.phone_pairing","status":"NOT_RUN"},{"evidence":"EXTERNAL_OR_ARTIFACT","id":"human.first_run_pairing","status":"NOT_RUN"}],"limitations":["Source proof does not prove an unsigned or signed application artifact.","Keychain storage requires a correctly signed application entitlement and remains NOT_RUN.","Pairing HMAC authenticates integrity; the local TCP payload is not encrypted.","Real Mac, Android phone, and moderated first-run pairing remain NOT_RUN."],"phaseCommits":{"phaseA":"33d27125f13465dc05ed10983f3523447eae08c9","phaseB":"08c9ae50ee0a46ad1682b03c4989130ae78f2bad"},"receiptDigest":"de68374a862ee60341be4cd29986a7b3728b05ac9b81eed224bfc7e0ca5e0112","schema":"codecks.pairing.phase-ab.source-evidence.v1","scope":"EXACT_PHASE_B_SOURCE_AND_CPU_UNIT","sourceCommit":"08c9ae50ee0a46ad1682b03c4989130ae78f2bad","sources":[{"commit":"08c9ae50ee0a46ad1682b03c4989130ae78f2bad","path":"app/src/androidTest/java/io/codecks/ui/app/MainActivityStartupInstrumentedTest.kt","sha256":"7cefbea4b8a59b5072dd27ae332800b4a8b2b7e3eb0597949becbb8d995a9f89"},{"commit":"08c9ae50ee0a46ad1682b03c4989130ae78f2bad","path":"app/src/main/java/io/codecks/AppCompositionRoot.kt","sha256":"2459acc6a1ebca31f8a1beb3b282535e9432fbc25801a31bd412b48f81bb8619"},{"commit":"08c9ae50ee0a46ad1682b03c4989130ae78f2bad","path":"app/src/main/java/io/codecks/AppFeatureBinders.kt","sha256":"1ff10bc7077ebc53469dc4b2641d1891163c92ea4e0e07b9f6dc5dfda39fe66f"},{"commit":"08c9ae50ee0a46ad1682b03c4989130ae78f2bad","path":"app/src/main/java/io/codecks/AppHelperRuntime.kt","sha256":"953771b6e558d48df24dda97acc44be56c58e6152b7addaddfe6080e40f7aaf6"},{"commit":"08c9ae50ee0a46ad1682b03c4989130ae78f2bad","path":"app/src/main/java/io/codecks/MainActivity.kt","sha256":"bb48755678e2d38e7a0e79137b0100ec1036576304e6a76bc7f76499c0ab3772"},{"commit":"08c9ae50ee0a46ad1682b03c4989130ae78f2bad","path":"app/src/main/java/io/codecks/data/reactive/helper/PairingV2Crypto.kt","sha256":"e8b504b0c9770a37fbe964d5c7003324ce15d57c2027a4977ef118234dad2341"},{"commit":"08c9ae50ee0a46ad1682b03c4989130ae78f2bad","path":"app/src/main/java/io/codecks/data/reactive/helper/ReactiveHelperPairingImporter.kt","sha256":"bc3554268b74646e6161e84fb880a6c192e500f2ea62169885908a9d0ca80fbc"},{"commit":"08c9ae50ee0a46ad1682b03c4989130ae78f2bad","path":"app/src/main/java/io/codecks/data/reactive/helper/ReactiveHelperPairingV2Client.kt","sha256":"20c3665da26e122b8858305de501f127f8f9cfecbdb10de23bdea3e5310bf4ba"},{"commit":"08c9ae50ee0a46ad1682b03c4989130ae78f2bad","path":"app/src/main/java/io/codecks/ui/settings/CodecksHelperUiState.kt","sha256":"f3b5eb878d86e482c03fb353c8712487fced5823bc4d881937e6b634df575698"},{"commit":"08c9ae50ee0a46ad1682b03c4989130ae78f2bad","path":"app/src/main/java/io/codecks/ui/settings/SettingsConnectionSections.kt","sha256":"6dd26ab571b41934cc89fcecbd8f262360dfe5d3213b0ff9b74b3d43d7820314"},{"commit":"08c9ae50ee0a46ad1682b03c4989130ae78f2bad","path":"app/src/main/java/io/codecks/ui/settings/SettingsScreen.kt","sha256":"9e03a48154a1c2d874fb16ee0da643b2ef1d3c8d29898dd85ff41ffae7f3832a"},{"commit":"08c9ae50ee0a46ad1682b03c4989130ae78f2bad","path":"app/src/test/java/io/codecks/data/reactive/helper/ReactiveHelperPairingImporterTest.kt","sha256":"b1d76d3f5e93ce30f7813762e178c42141fe49e81419daeb1b6ac914d371c242"},{"commit":"08c9ae50ee0a46ad1682b03c4989130ae78f2bad","path":"app/src/test/java/io/codecks/data/reactive/helper/ReactiveHelperPairingV2ClientTest.kt","sha256":"f4eb99af8c5965424a8eadb382c4e42a4030931d9bf503e1c791ba2f196dba8e"},{"commit":"08c9ae50ee0a46ad1682b03c4989130ae78f2bad","path":"macHelper/Sources/CodecksMacHelper/HelperSystemStatus.swift","sha256":"b0daa3f971e0b2c493c536428cd5c8c8af41f4d85d79ab1571a4a539f29c29e6"},{"commit":"08c9ae50ee0a46ad1682b03c4989130ae78f2bad","path":"macHelper/Sources/CodecksMacHelper/PairingCredentialStore.swift","sha256":"f1007ac074da5e331582aaed048ce35d9d61d3d8826962e5c9169bcfbfc09ceb"},{"commit":"08c9ae50ee0a46ad1682b03c4989130ae78f2bad","path":"macHelper/Sources/CodecksMacHelper/PairingStore.swift","sha256":"7384bff31f2bedde856bfc3a668e9c2edd992859987ac1dd259623201865c933"},{"commit":"08c9ae50ee0a46ad1682b03c4989130ae78f2bad","path":"macHelper/Sources/CodecksMacHelper/PairingV2.swift","sha256":"195cee3bc11d472275851a2624c7d9c3e84dc775cb3dc56ae49e8a4e573aa811"},{"commit":"08c9ae50ee0a46ad1682b03c4989130ae78f2bad","path":"macHelper/Sources/CodecksMacHelper/PairingV2Controller.swift","sha256":"3274b9fc1bfe58cd912b50eec54b95201d3dd9f370d1b0f88f874cbdf985a1ca"},{"commit":"08c9ae50ee0a46ad1682b03c4989130ae78f2bad","path":"macHelper/Sources/CodecksMacHelper/ReactiveFramedTransportService.swift","sha256":"7936cfcde443d372cffedb099aecb252be04ed2e2d94811d869b18bfbf6fffcf"},{"commit":"08c9ae50ee0a46ad1682b03c4989130ae78f2bad","path":"macHelper/Sources/CodecksMacHelper/ReactiveMacHelperRuntime.swift","sha256":"03fd6c2314b054881b61cacc4f95c06d336e0b639c7dcb808d0b882681b4c478"},{"commit":"08c9ae50ee0a46ad1682b03c4989130ae78f2bad","path":"macHelper/Sources/CodecksMacHelper/ReactiveSessionCoordinator.swift","sha256":"3a3cc7d29cbf1feea9337e06c128c7623a16b77717d408821024b8ccbefacad9"},{"commit":"08c9ae50ee0a46ad1682b03c4989130ae78f2bad","path":"macHelper/Sources/CodecksMacHelper/ReactiveTcpHelperServer.swift","sha256":"58c3791c12e02dce83409420c8c458818b73c133205f50e9b473f62ec67ff132"},{"commit":"08c9ae50ee0a46ad1682b03c4989130ae78f2bad","path":"macHelper/Sources/CodecksMacHelperApp/HelperAppModel.swift","sha256":"a7c44b7e6e0f3a6d5e34502736cadb9c0dfbcd8f733536062e3f067f0ce0f5bb"},{"commit":"08c9ae50ee0a46ad1682b03c4989130ae78f2bad","path":"macHelper/Sources/CodecksMacHelperApp/HelperViews.swift","sha256":"6b1279c99f863973bd772777b6eea78465d7c7fb4df4e05faf816a52d6e9fa83"},{"commit":"08c9ae50ee0a46ad1682b03c4989130ae78f2bad","path":"macHelper/Sources/CodecksMacHelperApp/PairingQRCode.swift","sha256":"d1d95ff0f4e5795fa0e491f3ab7602ab0814d8cadf268cdc2e5c4779d4a0faa9"},{"commit":"08c9ae50ee0a46ad1682b03c4989130ae78f2bad","path":"macHelper/Sources/CodecksMacHelperCLI/main.swift","sha256":"0105d774bf0986ef128e2b3024d1b250721b6bcebc8590e33bcd93b721fcd9ba"},{"commit":"08c9ae50ee0a46ad1682b03c4989130ae78f2bad","path":"macHelper/Tests/CodecksMacHelperTests/PairingV2ControllerTests.swift","sha256":"085bca81d7c60d16378338526bc23e49899ff1438eeb94408079b75d16b73612"},{"commit":"08c9ae50ee0a46ad1682b03c4989130ae78f2bad","path":"macHelper/Tests/CodecksMacHelperTests/PairingV2Tests.swift","sha256":"4338c719045a8460ec38062c74a6ab80bef5e85c935eca6cbb4625337b24e3ed"},{"commit":"08c9ae50ee0a46ad1682b03c4989130ae78f2bad","path":"macHelper/Tests/CodecksMacHelperTests/ReactiveMacHelperTests.swift","sha256":"d3254a136f4b529ee182c05d9a9f23ca6005a065c0139fd90da0dab2c82ba7aa"},{"commit":"08c9ae50ee0a46ad1682b03c4989130ae78f2bad","path":"macHelper/scripts/build-local-app.sh","sha256":"e448687cbb90a135ab12e047bda9ae4df4e8830d8066807a2e87a898d19017c6"},{"commit":"08c9ae50ee0a46ad1682b03c4989130ae78f2bad","path":"macHelper/scripts/install-launchd.sh","sha256":"bf90b420039ff857263c3f1c77a124f1665f9d33e2005f68